{
  "$schema": "https://json-schema.org/draft/2020-12/schema",
  "type": "object",
  "properties": {
    "databaseUrl": { "type": "string" },
    "contextType": { "type": "string" },
    "transactionType": { "type": "string" },
    "timestampColumns": {
      "type": "object",
      "properties": {
        "createdAt": {
          "type": "object",
          "properties": {
            "names": { "type": "array", "items": { "type": "string" } },
            "required": { "type": "boolean" }
          },
          "required": ["names"],
          "additionalProperties": false
        },
        "updatedAt": {
          "type": "object",
          "properties": {
            "names": { "type": "array", "items": { "type": "string" } },
            "required": { "type": "boolean" }
          },
          "required": ["names"],
          "additionalProperties": false
        },
        "deletedAt": {
          "type": "object",
          "properties": {
            "names": { "type": "array", "items": { "type": "string" } },
            "required": { "type": "boolean" }
          },
          "required": ["names"],
          "additionalProperties": false
        }
      }
    },
    "temporal": {
      "anyOf": [
        { "type": "boolean" },
        { "type": "object", "properties": { "timeZone": { "type": "string" } }, "required": ["timeZone"] }
      ]
    },
    "createFlushFunction": { "anyOf": [{ "type": "boolean" }, { "type": "array", "items": { "type": "string" } }] },
    "entitiesDirectory": { "default": "./src/entities", "type": "string" },
    "codegenPlugins": { "type": "array", "items": { "type": "string" } },
    "entities": {
      "type": "object",
      "propertyNames": { "type": "string" },
      "additionalProperties": {
        "type": "object",
        "properties": {
          "tag": { "type": "string" },
          "tableName": { "type": "string" },
          "fields": {
            "type": "object",
            "propertyNames": { "type": "string" },
            "additionalProperties": {
              "type": "object",
              "properties": {
                "derived": { "anyOf": [{ "type": "string", "const": "sync" }, { "type": "string", "const": "async" }] },
                "protected": { "type": "boolean" },
                "ignore": { "type": "boolean" },
                "superstruct": { "type": "string" },
                "zodSchema": { "type": "string" },
                "type": { "type": "string" },
                "serde": { "type": "string" },
                "stiDiscriminator": {
                  "type": "object",
                  "propertyNames": { "type": "string" },
                  "additionalProperties": { "type": "string" }
                },
                "stiType": { "anyOf": [{ "type": "string" }, { "type": "array", "items": { "type": "string" } }] },
                "notNull": { "type": "boolean" },
                "hasDefault": { "type": "boolean" },
                "lazy": { "type": "boolean" },
                "assertUnchanged": { "type": "boolean" }
              },
              "additionalProperties": false
            }
          },
          "relations": {
            "type": "object",
            "propertyNames": { "type": "string" },
            "additionalProperties": {
              "type": "object",
              "properties": {
                "derived": { "type": "string", "const": "async" },
                "polymorphic": {
                  "anyOf": [{ "type": "string", "const": "notNull" }, { "type": "boolean", "const": true }]
                },
                "large": { "type": "boolean" },
                "orderBy": { "type": "string" },
                "softDeletes": {
                  "anyOf": [{ "type": "string", "const": "include" }, { "type": "string", "const": "exclude" }]
                },
                "stiType": { "anyOf": [{ "type": "string" }, { "type": "array", "items": { "type": "string" } }] },
                "subType": { "type": "string" },
                "skipRecursiveRelations": { "type": "boolean" },
                "notNull": { "type": "boolean" },
                "hasDefault": { "type": "boolean" }
              },
              "additionalProperties": false
            }
          },
          "abstract": { "type": "boolean" },
          "orderBy": { "type": "string" },
          "uniqueBy": {
            "anyOf": [
              { "type": "string" },
              { "type": "array", "items": { "type": "string" } },
              { "type": "array", "items": { "type": "array", "items": { "type": "string" } } }
            ]
          }
        },
        "required": ["tag"],
        "additionalProperties": false
      }
    },
    "ignoredTables": { "type": "array", "items": { "type": "string" } },
    "idType": {
      "anyOf": [
        { "type": "string", "const": "tagged-string" },
        { "type": "string", "const": "untagged-string" },
        { "type": "string", "const": "number" }
      ]
    },
    "tagDelimiter": { "type": "string" },
    "nonDeferredForeignKeys": {
      "anyOf": [
        { "type": "string", "const": "error" },
        { "type": "string", "const": "warn" },
        { "type": "string", "const": "ignore" }
      ]
    },
    "esm": { "type": "boolean" },
    "paginationStyle": {
      "default": "cursor",
      "anyOf": [{ "type": "string", "const": "cursor" }, { "type": "string", "const": "limit" }]
    },
    "docs": { "type": "boolean" },
    "skills": { "type": "boolean" },
    "outputDocs": { "type": "boolean" },
    "allowImportingTsExtensions": { "type": "boolean" },
    "codemodVersion": { "default": 0, "type": "integer", "minimum": 0, "maximum": 9007199254740991 },
    "schemas": { "type": "array", "items": { "type": "string" } }
  },
  "additionalProperties": false
}
