{
  "codegenPlugins": ["joist-graphql-codegen"],
  "contextType": "Context@src/context",
  "entities": {
    "Author": {
      "fields": {
        "address": { "superstruct": "address@src/entities/types" },
        "bookComments": { "derived": "async" },
        "ignoreEnumFk": { "ignore": true },
        "ignoreEnumFkRequiredWithDefault": { "ignore": true },
        "ignoreUsedToBeUseful": { "ignore": true },
        "ignoreUsedToBeUsefulRequiredWithDefault": { "ignore": true },
        "initials": { "derived": "sync" },
        "numberOfBooks": { "derived": "async" },
        "wasEverPopular": { "protected": true }
      },
      "tag": "a"
    },
    "AuthorStat": { "tag": "as" },
    "Book": { "tag": "b" },
    "BookAdvance": { "tag": "ba" },
    "BookReview": { "fields": { "isPublic": { "derived": "async" } }, "tag": "br" },
    "Comment": { "relations": { "parent": { "polymorphic": "notNull" } }, "tag": "comment" },
    "Critic": {
      "fields": {
        "ignoreFavouriteBook": { "ignore": true },
        "ignoreWorstBook": { "ignore": true },
        "tags": { "ignore": true }
      },
      "tag": "c"
    },
    "CriticColumn": { "tag": "cc" },
    "Image": { "tag": "i" },
    "LargePublisher": { "tag": "p" },
    "Publisher": { "abstract": true, "tag": "p" },
    "PublisherGroup": { "relations": { "critics": { "large": true } }, "tag": "pg" },
    "SmallPublisher": { "fields": { "allAuthorNames": { "derived": "async" } }, "tag": "p" },
    "Tag": { "relations": { "authors": { "large": true } }, "tag": "t" }
  },
  "entitiesDirectory": "./src/entities"
}
