{
  "codegenPlugins": [],
  "codemodVersion": 3,
  "contextType": "Context@src/context",
  "entities": {
    "Author": { "tag": "a" },
    "Book": { "tag": "b" },
    "BookReview": { "tag": "br" },
    "Comment": { "relations": { "parent": { "polymorphic": "notNull" } }, "tag": "c" }
  },
  "entitiesDirectory": "./src/entities",
  "idType": "untagged-string"
}
