{
  "codegenPlugins": [],
  "codemodVersion": 3,
  "contextType": "Context@src/context",
  "databaseUrl": "postgres://joist:local@localhost:5435/schema_misc",
  "entities": {
    "Artist": { "tag": "artist" },
    "Author": { "tag": "a" },
    "Book": { "tag": "b" },
    "DatabaseOwner": { "tag": "do" },
    "Painting": { "tag": "p" },
    "Tag": { "tag": "t" }
  },
  "entitiesDirectory": "./src/entities",
  "ignoredTables": ["pgmigrations"],
  "timestampColumns": {
    "createdAt": { "names": ["created_at", "createdAt"], "required": false },
    "updatedAt": { "names": ["updated_at", "updatedAt"], "required": false }
  }
}
