{
  "codegenPlugins": ["joist-graphql-codegen"],
  "codemodVersion": 3,
  "contextType": "Context@src/context",
  "docs": true,
  "entities": {
    "AdminUser": { "tag": "u" },
    "Author": {
      "fields": {
        "address": { "superstruct": "address@src/entities/types" },
        "bookComments": { "derived": "async" },
        "businessAddress": { "zodSchema": "AddressSchema@src/entities/types" },
        "favoriteColors": { "assertUnchanged": true },
        "favoriteShape": { "assertUnchanged": true },
        "ignoreEnumFk": { "ignore": true },
        "ignoreEnumFkRequiredWithDefault": { "ignore": true },
        "ignoreUsedToBeUseful": { "ignore": true },
        "ignoreUsedToBeUsefulRequiredWithDefault": { "ignore": true },
        "imageFileName": { "derived": "async" },
        "initials": { "derived": "sync" },
        "menteeNames": { "derived": "async" },
        "mentorNames": { "derived": "async" },
        "nickNamesUpper": { "derived": "async" },
        "numberOfBooks": { "derived": "async" },
        "numberOfPublicReviews": { "derived": "async" },
        "numberOfPublicReviews2": { "derived": "async" },
        "quotes": { "superstruct": "quotes@src/entities/types" },
        "rangeOfBooks": { "derived": "async" },
        "search": { "derived": "async" },
        "tagsOfAllBooks": { "derived": "async" },
        "tsSearch": { "ignore": true },
        "wasEverPopular": { "protected": true }
      },
      "relations": {
        "bestReviews": { "derived": "async" },
        "books": { "orderBy": "order" },
        "favoriteBook": { "derived": "async" },
        "menteesClosure": { "derived": "async" },
        "rootMentor": { "derived": "async" }
      },
      "tag": "a",
      "uniqueBy": [["ssn"]]
    },
    "AuthorSchedule": { "fields": { "overview": { "assertUnchanged": true } }, "tag": "authorSchedule" },
    "AuthorStat": { "tag": "as" },
    "Book": {
      "fields": { "search": { "derived": "async" } },
      "orderBy": "title",
      "tag": "b",
      "uniqueBy": [["author", "title"]]
    },
    "BookAdvance": { "tag": "ba" },
    "BookReview": {
      "fields": {
        "isPublic": { "derived": "async" },
        "isTest": { "derived": "async" },
        "isTestChain": { "derived": "async" }
      },
      "orderBy": "critic",
      "tag": "br"
    },
    "Child": { "tag": "child" },
    "ChildGroup": { "tag": "cg" },
    "ChildItem": { "tag": "ci" },
    "Comment": {
      "fields": { "parentTaggedId": { "derived": "async" }, "parentTags": { "derived": "async" } },
      "relations": { "parent": { "polymorphic": "notNull" }, "scope": { "polymorphic": true } },
      "tag": "comment"
    },
    "Critic": {
      "fields": {
        "ignoreFavouriteBook": { "ignore": true },
        "ignoreWorstBook": { "ignore": true },
        "tags": { "ignore": true }
      },
      "tag": "c"
    },
    "CriticColumn": { "tag": "cc" },
    "Employee": { "relations": { "managersClosure": { "derived": "async" } }, "tag": "e" },
    "Image": { "tag": "i" },
    "LargePublisher": {
      "fields": { "rating": { "notNull": true } },
      "relations": { "spotlightAuthor": { "notNull": true } },
      "tag": "p"
    },
    "ParentGroup": {
      "fields": { "bulkData": { "lazy": true }, "lazyEmbedding": { "lazy": true }, "requiredData": { "lazy": true } },
      "tag": "parentGroup"
    },
    "ParentItem": { "tag": "pi" },
    "Publisher": {
      "abstract": true,
      "fields": {
        "bookAdvanceTitlesSnapshot": { "derived": "async" },
        "favoriteAuthorName": { "derived": "async" },
        "numberOfBookAdvancesSnapshot": { "derived": "async" },
        "numberOfBookReviews": { "derived": "async" },
        "status": { "assertUnchanged": true },
        "titlesOfFavoriteBooks": { "derived": "async" }
      },
      "relations": {
        "authors": { "orderBy": "numberOfBooks", "softDeletes": "include" },
        "favoriteAuthor": { "derived": "async" }
      },
      "tag": "p"
    },
    "PublisherGroup": {
      "fields": {
        "numberOfBookReviews": { "derived": "async" },
        "numberOfBookReviewsFormatted": { "derived": "async" }
      },
      "relations": { "critics": { "large": true } },
      "tag": "pg"
    },
    "SmallPublisher": {
      "fields": { "allAuthorNames": { "derived": "async" }, "city": { "hasDefault": true } },
      "relations": {
        "group": { "subType": "SmallPublisherGroup" },
        "selfReferential": { "skipRecursiveRelations": true }
      },
      "tag": "p"
    },
    "SmallPublisherGroup": { "relations": { "publishers": { "subType": "SmallPublisher" } }, "tag": "pg" },
    "Tag": { "relations": { "authors": { "softDeletes": "include" } }, "tag": "t" },
    "Task": {
      "fields": {
        "asyncDerived": { "derived": "async" },
        "sharedSubtypeField": { "stiType": ["TaskNew", "TaskOld"] },
        "specialNewField": { "stiType": "NEW" },
        "specialOldField": { "notNull": true, "stiType": "TaskOld" },
        "specialOldFieldWithDefault": { "stiType": "TaskOld" },
        "syncDerived": { "derived": "sync" },
        "type": { "stiDiscriminator": { "NEW": "TaskNew", "OLD": "TaskOld", "THIRD": "TaskThird" } }
      },
      "relations": {
        "comments": { "stiType": "TaskOld" },
        "copiedFrom": { "subType": "self" },
        "newTaskTaskItems": { "stiType": "TaskNew" },
        "oldTaskTaskItems": { "stiType": "TaskOld" },
        "parentOldTask": { "stiType": "TaskOld" },
        "publishers": { "stiType": "TaskOld" },
        "selfReferential": { "skipRecursiveRelations": true, "stiType": "TaskNew" },
        "selfReferentialTasks": { "stiType": "TaskNew" },
        "specialNewAuthor": { "stiType": "TaskNew" },
        "tasks": { "stiType": "TaskOld" }
      },
      "tag": "task"
    },
    "TaskItem": { "tag": "ti" },
    "User": {
      "fields": {
        "ipAddress": { "type": "IpAddress@src/entities/types" },
        "password": { "serde": "PasswordValueSerde@src/entities/types", "type": "PasswordValue@src/entities/types" },
        "passwordHistory": {
          "serde": "PasswordValueSerde@src/entities/types",
          "type": "PasswordValue@src/entities/types"
        }
      },
      "relations": { "favoritePublisher": { "polymorphic": true }, "manager": { "skipRecursiveRelations": true } },
      "tag": "u"
    }
  },
  "entitiesDirectory": "./src/entities",
  "outputDocs": true,
  "paginationStyle": "limit",
  "transactionType": "PoolClient@pg"
}
