{
  "codegenPlugins": ["joist-graphql-codegen"],
  "contextType": "Context@src/context",
  "entities": {
    "Author": {
      "fields": {
        "initials": { "derived": "sync" },
        "numberOfBooks": { "derived": "async" },
        "softDropLegacyFk": { "ignore": true },
        "softDropUsedToBeUseful": { "ignore": true },
        "wasEverPopular": { "protected": true }
      },
      "tag": "a"
    },
    "Book": { "tag": "b" },
    "BookAdvance": { "tag": "ba" },
    "BookReview": { "fields": { "isPublic": { "derived": "async" } }, "tag": "br" },
    "Critic": {
      "fields": { "favouriteBook": { "ignore": true }, "tags": { "ignore": true }, "worstBook": { "ignore": true } },
      "tag": "c"
    },
    "Image": { "tag": "i" },
    "Publisher": { "tag": "p" },
    "Tag": { "tag": "t" }
  },
  "entitiesDirectory": "./src/entities"
}
